question,option1,option2,option3,option4,correct_option,explanation,difficulty
What is the capital of India?,Mumbai,New Delhi,Kolkata,Chennai,option2,New Delhi has been the capital of India since 1911.,easy
Which planet is closest to the Sun?,Earth,Venus,Mercury,Mars,option3,Mercury is the closest planet to the Sun in our solar system.,easy
How many bones are in the adult human body?,196,206,216,186,option2,The adult human body has 206 bones.,medium
What is the chemical formula of water?,H2O2,HO,H2O,H3O,option3,Water is composed of two hydrogen atoms and one oxygen atom: H2O.,easy
Who wrote the play Romeo and Juliet?,Charles Dickens,Leo Tolstoy,William Shakespeare,Mark Twain,option3,Romeo and Juliet was written by William Shakespeare around 1595.,easy
